{
  "schema_version": "0.1.0",
  "id": "person-example",
  "type": "node",
  "kind": "person",
  "name": "示例人物（虚构）",
  "aliases": [],
  "status": "stub",
  "summary": null,
  "source_ids": [],
  "privacy": {
    "risk": "none",
    "handling": "as-recorded",
    "indexing": "include",
    "notes": "虚构结构示例。"
  },
  "provenance": {
    "created_by": "human",
    "created_at": "2026-09-02T00:00:00Z",
    "contributors": [],
    "agent_run_id": null,
    "input_hashes": []
  }
}
